<?xml version="1.0"?>
<xs:schema xmlns:xs="http://www.w3.org/2001/XMLSchema" attributeFormDefault="unqualified" elementFormDefault="qualified">
  <xs:element name="grille" type="grilleType">
    <xs:annotation>
      <xs:documentation> Fin du mode de jeu CLASSIQUE </xs:documentation>
    </xs:annotation>
  </xs:element>
  <xs:complexType name="piecesType">
    <xs:sequence>
      <xs:element type="xs:string" name="cases"/>
      <xs:element type="xs:string" name="description"/>
    </xs:sequence>
    <xs:attribute type="xs:string" name="ship" use="optional"/>
  </xs:complexType>
  <xs:complexType name="pathType">
    <xs:sequence>
      <xs:element type="piecesType" name="pieces" maxOccurs="unbounded" minOccurs="0"/>
    </xs:sequence>
    <xs:attribute type="xs:string" name="emplacement"/>
  </xs:complexType>
  <xs:complexType name="modeDeJeuType">
    <xs:sequence>
      <xs:element type="xs:string" name="taille"/>
      <xs:element type="pathType" name="path">
        <xs:annotation>
          <xs:documentation><![CDATA[<tir>
    <toucher img = "hit.png"> </toucher>
    <rater img2 = "miss.png"> </rater>
    </tir>]]></xs:documentation>
        </xs:annotation>
      </xs:element>
    </xs:sequence>
    <xs:attribute type="xs:string" name="nomDeJeu"/>
  </xs:complexType>
  <xs:complexType name="grilleType">
    <xs:sequence>
      <xs:element type="modeDeJeuType" name="modeDeJeu"/>
    </xs:sequence>
  </xs:complexType>
</xs:schema>

